{
  "loadId": "6f1c0a2e-7b14-4d2a-9c31-0a6e5d8b41f2",
  "sourceCode": "ass-building",
  "sourceFile": "dAssBuilding_v04.xsd",
  "tables": [
    {
      "name": "ass_building",
      "columns": [
        { "name": "value_code", "type": "string", "length": 12, "nullable": false },
        { "name": "name", "type": "string", "length": 500, "nullable": false }
      ],
      "primaryKey": ["value_code"],
      "foreignKeys": []
    }
  ]
}
